{"plan_id":"similarweb_trial_capture_v1","provider":"SIMILARWEB","trial_window_days":7,"activation_status":"NOT_STARTED","human_target_review_completed":true,"acquisition_methods":["LOCAL_EXPORT","MANUAL_RECORDED","SIMILARWEB_DATA_EXPORTER","SIMILARWEB_API_ENTITLED"],"targets":[{"domain":"dominionhealing.org","vertical_id":"commerce_fulfillment","priority":1,"purpose":"OWNED_BASELINE","countries":["US"],"metrics":["estimated_visits","bounce_rate","pages_per_visit","average_visit_duration_seconds","channel_shares","geography_shares","search_keywords","referral_domains"]},{"domain":"thorne.com","vertical_id":"commerce_fulfillment","priority":2,"purpose":"CATEGORY_LEADER","countries":["US"],"metrics":["estimated_visits","bounce_rate","pages_per_visit","average_visit_duration_seconds","channel_shares","geography_shares","search_keywords","referral_domains"]},{"domain":"ritual.com","vertical_id":"commerce_fulfillment","priority":3,"purpose":"CATEGORY_LEADER","countries":["US"],"metrics":["estimated_visits","bounce_rate","pages_per_visit","average_visit_duration_seconds","channel_shares","geography_shares","search_keywords","referral_domains"]},{"domain":"iherb.com","vertical_id":"commerce_fulfillment","priority":4,"purpose":"CATEGORY_LEADER","countries":["US"],"metrics":["estimated_visits","bounce_rate","pages_per_visit","average_visit_duration_seconds","channel_shares","geography_shares","search_keywords","referral_domains"]},{"domain":"vitacost.com","vertical_id":"commerce_fulfillment","priority":5,"purpose":"CATEGORY_LEADER","countries":["US"],"metrics":["estimated_visits","bounce_rate","pages_per_visit","average_visit_duration_seconds","channel_shares","geography_shares","search_keywords","referral_domains"]},{"domain":"vitaminshoppe.com","vertical_id":"commerce_fulfillment","priority":6,"purpose":"CATEGORY_LEADER","countries":["US"],"metrics":["estimated_visits","bounce_rate","pages_per_visit","average_visit_duration_seconds","channel_shares","geography_shares","search_keywords","referral_domains"]},{"domain":"gnc.com","vertical_id":"commerce_fulfillment","priority":7,"purpose":"CATEGORY_LEADER","countries":["US"],"metrics":["estimated_visits","bounce_rate","pages_per_visit","average_visit_duration_seconds","channel_shares","geography_shares","search_keywords","referral_domains"]},{"domain":"cymbiotika.com","vertical_id":"commerce_fulfillment","priority":8,"purpose":"DIRECT_BENCHMARK","countries":["US"],"metrics":["estimated_visits","bounce_rate","pages_per_visit","average_visit_duration_seconds","channel_shares","geography_shares","search_keywords","referral_domains"]},{"domain":"happymammoth.com","vertical_id":"commerce_fulfillment","priority":9,"purpose":"DIRECT_BENCHMARK","countries":["US"],"metrics":["estimated_visits","bounce_rate","pages_per_visit","average_visit_duration_seconds","channel_shares","geography_shares","search_keywords","referral_domains"]},{"domain":"three.store","vertical_id":"commerce_fulfillment","priority":10,"purpose":"DIRECT_BENCHMARK","countries":["US"],"metrics":["estimated_visits","bounce_rate","pages_per_visit","average_visit_duration_seconds","channel_shares","geography_shares","search_keywords","referral_domains"]},{"domain":"wellnessshoppingonline.com","vertical_id":"commerce_fulfillment","priority":11,"purpose":"DIRECT_BENCHMARK","countries":["US"],"metrics":["estimated_visits","bounce_rate","pages_per_visit","average_visit_duration_seconds","channel_shares","geography_shares","search_keywords","referral_domains"]},{"domain":"terrasomawellness.com","vertical_id":"commerce_fulfillment","priority":12,"purpose":"DIRECT_BENCHMARK","countries":["US"],"metrics":["estimated_visits","bounce_rate","pages_per_visit","average_visit_duration_seconds","channel_shares","geography_shares","search_keywords","referral_domains"]},{"domain":"semrush.com","vertical_id":"services_lead_generation","priority":13,"purpose":"SERVICE_PRODUCT_BENCHMARK","countries":["US"],"metrics":["estimated_visits","bounce_rate","pages_per_visit","average_visit_duration_seconds","channel_shares","geography_shares","search_keywords","referral_domains"]},{"domain":"ahrefs.com","vertical_id":"services_lead_generation","priority":14,"purpose":"SERVICE_PRODUCT_BENCHMARK","countries":["US"],"metrics":["estimated_visits","bounce_rate","pages_per_visit","average_visit_duration_seconds","channel_shares","geography_shares","search_keywords","referral_domains"]},{"domain":"spyfu.com","vertical_id":"services_lead_generation","priority":15,"purpose":"SERVICE_PRODUCT_BENCHMARK","countries":["US"],"metrics":["estimated_visits","bounce_rate","pages_per_visit","average_visit_duration_seconds","channel_shares","geography_shares","search_keywords","referral_domains"]}],"daily_schedule":[{"day":0,"tasks":["review target manifest","confirm available trial capabilities","prepare local storage","record billing cancellation checkpoint"]},{"day":1,"tasks":["capture owned baseline","capture top three category leaders","record credits and accessible history"]},{"day":2,"tasks":["capture remaining category leaders","export channel and geography metrics","run ingestion and deduplication"]},{"day":3,"tasks":["capture direct benchmarks","export search and referral signals","run daily completeness report"]},{"day":4,"tasks":["capture service-product benchmarks","fill missing metrics","validate provider attribution"]},{"day":5,"tasks":["refresh priority-one through priority-five targets","compare periods","reserve credits for gaps"]},{"day":6,"tasks":["close missing-target gaps","run final duplicate and evidence checks","human billing cancellation checkpoint"]},{"day":7,"tasks":["final exports","archive raw and normalized evidence","generate closeout completeness report","stop all trial collection"]}],"storage":{"raw_export_path":"runtime/private/similarweb/raw","normalized_path":"runtime/private/similarweb/normalized","manifest_path":"runtime/private/similarweb/manifests","evidence_ledger_path":"runtime/ledger/similarweb-trial.jsonl"},"billing_control":{"auto_billing_acknowledged":true,"cancellation_checkpoint_day":6,"owner":"human_overseer","automatic_cancellation":false},"quality_gates":["source_evidence_recorded","domain_and_period_validated","duplicate_capture_rejected","estimated_data_not_revenue_verified","daily_completeness_reported","no_automated_platform_scraping"],"credit_control":{"discover_capabilities_before_paid_queries":true,"api_entitlement_required":true,"reserve_percent":15,"max_requests_per_second":2}}